{
  "$schema": "http://json-schema.org/draft-07/schema#",
  "title": "Vehicle Agent Protocol Message",
  "type": "object",
  "required": ["message_type", "timestamp", "sender_id", "receiver_id"],
  "properties": {
    "message_id": {
      "type": "string"
    },
    "timestamp": {
      "type": "string",
      "format": "date-time"
    },
    "sender_id": {
      "type": "string",
      "pattern": "^(vehicle|fleet|user|system):[A-Za-z0-9_.-]+$"
    },
    "receiver_id": {
      "type": "string",
      "pattern": "^(vehicle|fleet|user|system):[A-Za-z0-9_.-]+$"
    },
    "message_type": {
      "type": "string",
      "enum": ["event", "query", "response", "sync_state", "notification"]
    },

    "event": {
      "type": "object",
      "properties": {
        "name": { "type": "string" },
        "severity": { "type": "string", "enum": ["low", "medium", "high"] },
        "location": { "type": "string" },
        "confidence": { "type": "number", "minimum": 0, "maximum": 1 }
      },
      "required": ["name"],
      "additionalProperties": true
    },

    "query": {
      "type": "object",
      "properties": {
        "type": { "type": "string" },
        "topic": { "type": "string" },
        "location": { "type": "string" },
        "context": { "type": "string" }
      },
      "required": ["type", "topic"],
      "additionalProperties": true
    },

    "response": {
      "type": "object",
      "properties": {
        "type": { "type": "string" },
        "data": { "type": "object" }
      },
      "required": ["type", "data"],
      "additionalProperties": true
    },

    "sync_state": {
      "type": "object",
      "additionalProperties": { "type": ["string", "number", "boolean", "null"] }
    },

    "notification": {
      "type": "object",
      "properties": {
        "type": { "type": "string" },
        "topic": { "type": "string" },
        "models_affected": {
          "type": "array",
          "items": { "type": "string" }
        },
        "source": { "type": "string" },
        "note": { "type": "string" }
      },
      "required": ["type", "topic"],
      "additionalProperties": true
    },

    "metadata": {
      "type": "object",
      "properties": {
        "vehicle_model": { "type": "string" },
        "agent_version": { "type": "string" },
        "language": { "type": "string" }
      },
      "additionalProperties": true
    }
  },
  "additionalProperties": false,
  "oneOf": [
    { "required": ["event"] },
    { "required": ["query"] },
    { "required": ["response"] },
    { "required": ["sync_state"] },
    { "required": ["notification"] }
  ]
}
